{
    "$schema": "./schemas/combat.schema.json",
    "flanking": {
        "enabled": true,
        "attackBonus": 2,
        "damageBonus": 0,
        "behindAttackBonus": 2,
        "behindDamageBonus": 2
    },
    "opportunityAttacks": {
        "enabled": true,
        "requiresMeleeWeapon": true,
        "oneReactionPerRound": true,
        "disengage": {
            "enabled": true,
            "consumesAction": true
        }
    },
    "initiative": {
        "baseAttribute": "wits",
        "diceExpression": "1d20",
        "tieBreaker": "HigherAttribute",
        "surpriseRoundBonus": 10
    },
    "death": {
        "unconsciousThreshold": 0,
        "deathThreshold": -10,
        "deathSavesEnabled": false,
        "deathSaveSuccesses": 3,
        "deathSaveFailures": 3
    }
}